{
  "ir_version": 2,
  "files": [
    "sections/appendix-dynamics.tex",
    "sections/appendix-prevalence.tex",
    "sections/appendix-bayes.tex",
    "sections/appendix-application.tex"
  ],
  "document": {
    "title": "Inference From Random Restarts appendix",
    "source_file": "main.tex"
  },
  "inventory": {
    "candidate_ids": [
      "inventory-gold:n1",
      "inventory-gold:n2",
      "inventory-gold:n3",
      "inventory-gold:n4",
      "inventory-gold:n5",
      "inventory-gold:n6",
      "inventory-gold:n7",
      "inventory-gold:n8",
      "inventory-gold:n9",
      "inventory-gold:n10",
      "inventory-gold:n11",
      "inventory-gold:n17",
      "inventory-gold:n18",
      "inventory-gold:n19",
      "inventory-gold:n20",
      "inventory-gold:n21",
      "inventory-gold:n22",
      "inventory-gold:n23",
      "inventory-gold:n24",
      "inventory-gold:n25",
      "inventory-gold:n26",
      "inventory-gold:n27",
      "inventory-gold:n28",
      "inventory-gold:n29",
      "inventory-gold:n30",
      "inventory-gold:n31",
      "inventory-gold:n32",
      "inventory-gold:n33",
      "inventory-gold:n34",
      "inventory-gold:n35",
      "inventory-gold:n36",
      "inventory-gold:n37",
      "inventory-gold:n38",
      "inventory-gold:n39",
      "inventory-gold:n40",
      "inventory-gold:n41",
      "inventory-gold:n42",
      "inventory-gold:n43",
      "inventory-gold:n44",
      "inventory-gold:n45",
      "inventory-gold:n46",
      "inventory-gold:n47",
      "inventory-gold:n48",
      "inventory-gold:n49",
      "inventory-gold:n50",
      "inventory-gold:n51",
      "inventory-gold:n52",
      "inventory-gold:n53",
      "inventory-gold:n54",
      "inventory-gold:n55",
      "inventory-gold:n56",
      "inventory-gold:n88",
      "inventory-gold:n89"
    ],
    "candidate_count": 53
  },
  "entities": [
    {
      "candidate_ids": [
        "inventory-gold:n1"
      ],
      "id": "gold:dyn.nagurney",
      "type": "external-result",
      "statement_location": [
        0,
        43,
        50
      ],
      "short_title": "Nagurney projected-system well-posedness theorem",
      "description": "Nagurney projected-system theorem gives global solutions and continuous dependence under one-sided Lipschitz and linear-growth conditions.",
      "source": "explicit"
    },
    {
      "candidate_ids": [
        "inventory-gold:n2"
      ],
      "id": "gold:dyn.global-flow",
      "type": "result",
      "statement_location": [
        0,
        34,
        41
      ],
      "kind": "lemma",
      "short_title": "Global well-posedness under global Lipschitzness",
      "description": "A globally Lipschitz vector field on X admits a unique continuous global projected flow.",
      "source": "explicit",
      "ref": "lemma:global-lip-flow"
    },
    {
      "candidate_ids": [
        "inventory-gold:n3"
      ],
      "id": "gold:dyn.mcshane",
      "type": "external-result",
      "statement_location": [
        0,
        77,
        86
      ],
      "short_title": "McShane extension theorem",
      "description": "Coordinatewise McShane extension extends the locally Lipschitz restriction on K_R to a globally Lipschitz map.",
      "source": "explicit"
    },
    {
      "candidate_ids": [
        "inventory-gold:n4"
      ],
      "id": "gold:dyn.localized-systems",
      "type": "result",
      "statement_location": [
        0,
        69,
        75
      ],
      "kind": "lemma",
      "short_title": "Lipschitz extensions on bounded regions",
      "description": "For locally Lipschitz Q, each bounded region has a globally Lipschitz extension agreeing with Q and a continuous global projected flow.",
      "source": "explicit",
      "ref": "lemma:localized-global-systems"
    },
    {
      "candidate_ids": [
        "inventory-gold:n5"
      ],
      "id": "gold:dyn.exit-time",
      "type": "setup",
      "statement_location": [
        0,
        89,
        99
      ],
      "kind": "definition",
      "short_title": "Localization exit times",
      "description": "Fixes localized flows and defines the first exit time sigma_{K_R}(x) from the localization ball.",
      "source": "explicit"
    },
    {
      "candidate_ids": [
        "inventory-gold:n6"
      ],
      "id": "gold:dyn.consistency",
      "type": "result",
      "statement_location": [
        0,
        107,
        117
      ],
      "kind": "lemma",
      "short_title": "Agreement before exit",
      "description": "Before the smaller localization exits, it solves the original projected dynamics and agrees with larger localizations.",
      "source": "explicit",
      "ref": "lemma:localized-consistency"
    },
    {
      "candidate_ids": [
        "inventory-gold:n7"
      ],
      "id": "gold:dyn.local-flow",
      "type": "result",
      "statement_location": [
        0,
        146,
        162
      ],
      "kind": "lemma",
      "short_title": "Constructing the maximal local flow",
      "description": "The supremum of localized exit times defines a positive-lifetime local flow solving the original projected dynamics.",
      "source": "explicit",
      "ref": "lemma:local-flow-construction"
    },
    {
      "candidate_ids": [
        "inventory-gold:n8"
      ],
      "id": "gold:dyn.maximal-flow",
      "type": "result",
      "statement_location": [
        0,
        179,
        184
      ],
      "kind": "lemma",
      "short_title": "Maximality and uniqueness",
      "description": "The patched lifetime is maximal and every local solution agrees with the unique maximal local solution map.",
      "source": "explicit",
      "ref": "lemma:maximal-local-flow"
    },
    {
      "candidate_ids": [
        "inventory-gold:n9"
      ],
      "id": "gold:dyn.regularity",
      "type": "result",
      "statement_location": [
        0,
        210,
        214
      ],
      "kind": "lemma",
      "short_title": "Regularity of tau and G",
      "description": "The maximal lifetime is lower semicontinuous and the local flow is continuous on its domain.",
      "source": "explicit",
      "ref": "lemma:lsc-flow-continuity"
    },
    {
      "candidate_ids": [
        "inventory-gold:n10"
      ],
      "id": "gold:dyn.lipschitz-result",
      "type": "result",
      "statement_location": [
        0,
        241,
        241
      ],
      "kind": "lemma",
      "short_title": "Local Lipschitzness implies well-behaved projected dynamics",
      "description": "If X is closed and convex and Q is locally Lipschitz, the projected dynamics are well behaved; under global Lipschitzness the maximal flow is global.",
      "source": "explicit",
      "ref": "lemma:Lipschitz"
    },
    {
      "candidate_ids": [
        "inventory-gold:n11"
      ],
      "id": "gold:dyn.measurability-result",
      "type": "result",
      "statement_location": [
        0,
        255,
        255
      ],
      "kind": "proposition",
      "short_title": "Dynamic solvers are measurable",
      "description": "Every dynamic solver g_Q is measurable from X to X disjoint union {dagger}.",
      "source": "explicit",
      "ref": "prop:measurable"
    },
    {
      "candidate_ids": [
        "inventory-gold:n17"
      ],
      "id": "gold:dyn.dct-cesaro",
      "type": "external-result",
      "statement_location": [
        0,
        395,
        410
      ],
      "short_title": "Dominated convergence / Cesaro averaging",
      "description": "Dominated convergence, equivalently Cesaro averaging, identifies the long-run time average with the limit value.",
      "source": "explicit"
    },
    {
      "candidate_ids": [
        "inventory-gold:n18"
      ],
      "id": "gold:dyn.containment",
      "type": "result",
      "statement_location": [
        0,
        337,
        342
      ],
      "kind": "lemma",
      "short_title": "Terminal outcomes lie among projected roots",
      "description": "Every ordinary dynamic-solver outcome is a root of the projected vector field, while nonconvergent outcomes are dagger.",
      "source": "explicit",
      "ref": "lemma:containment"
    },
    {
      "candidate_ids": [
        "inventory-gold:n19"
      ],
      "id": "gold:dyn.finite-rto-roots",
      "type": "result",
      "statement_location": [
        1,
        43,
        44
      ],
      "kind": "proposition",
      "short_title": "Finite reachable outcomes exactly when projected roots are finite",
      "description": "A dynamic solver has finitely many reachable terminal outcomes exactly when its projected vector field has finitely many roots.",
      "source": "explicit",
      "ref": "prop:finite-rto-roots"
    },
    {
      "candidate_ids": [
        "inventory-gold:n20"
      ],
      "id": "gold:prev.attractors-result",
      "type": "result",
      "statement_location": [
        1,
        259,
        259
      ],
      "kind": "proposition",
      "short_title": "Submersion probes imply prevalent finiteness of reachable terminal outcomes",
      "description": "Under convexity, root compactness, and submersion-probe hypotheses, prevalent dynamics have finitely many reachable terminal outcomes.",
      "source": "explicit",
      "ref": "prop:e-submersion-finite-attractors"
    },
    {
      "candidate_ids": [
        "inventory-gold:n21"
      ],
      "id": "gold:prev.ass-kkq",
      "type": "assumption",
      "statement_location": [
        1,
        55,
        63
      ],
      "kind": "standing",
      "short_title": "Root compactness",
      "description": "The projected-root set lies in a common compact set, and the state space has the required C2 boundary regularity.",
      "source": "explicit",
      "ref": "ass:kkq"
    },
    {
      "candidate_ids": [
        "inventory-gold:n22"
      ],
      "id": "gold:prev.ass-convex",
      "type": "assumption",
      "statement_location": [
        1,
        239,
        243
      ],
      "kind": "standing",